{
  "x-version": "1.0.0",
  "x-owner": "ace",
  "x-generated": "2026-04-19",
  "streamlit_version_observed": "1.39.0",
  "notes": "Initial pins seeded from the HY-IG v2 reference pair (per META-RPD) after Wave-5 reproducibility-audit flagged the URL-slug rule as implicit. Observed Streamlit 1.39.x slugification: strip leading `N_` numeric-and-underscore prefix, keep remaining underscores as underscores, do not modify case. Consumer smoke test at acceptance time asserts `streamlit.runtime.pages_manager` derives each file's slug to match `expected_slug`; mismatch blocks acceptance per GATE-29. Breadcrumb component reads `canonical_breadcrumb` instead of inferring. All 4 HY-IG v2 pages pinned; remaining pairs pinned as they reach reference-candidate status.",
  "pages": {
    "9_hy_ig_v2_spy_story.py": {
      "expected_slug": "hy_ig_v2_spy_story",
      "pair_id": "hy_ig_v2_spy",
      "page_type": "story",
      "canonical_breadcrumb": "HY-IG v2 -> Story",
      "inbound_links": ["app/app.py landing card", "9_hy_ig_v2_spy_evidence.py cross-ref", "9_hy_ig_v2_spy_strategy.py cross-ref", "9_hy_ig_v2_spy_methodology.py cross-ref"]
    },
    "9_hy_ig_v2_spy_evidence.py": {
      "expected_slug": "hy_ig_v2_spy_evidence",
      "pair_id": "hy_ig_v2_spy",
      "page_type": "evidence",
      "canonical_breadcrumb": "HY-IG v2 -> Evidence",
      "inbound_links": ["app/app.py landing card", "9_hy_ig_v2_spy_story.py cross-ref"]
    },
    "9_hy_ig_v2_spy_strategy.py": {
      "expected_slug": "hy_ig_v2_spy_strategy",
      "pair_id": "hy_ig_v2_spy",
      "page_type": "strategy",
      "canonical_breadcrumb": "HY-IG v2 -> Strategy",
      "inbound_links": ["app/app.py landing card", "9_hy_ig_v2_spy_story.py cross-ref", "9_hy_ig_v2_spy_evidence.py cross-ref"]
    },
    "9_hy_ig_v2_spy_methodology.py": {
      "expected_slug": "hy_ig_v2_spy_methodology",
      "pair_id": "hy_ig_v2_spy",
      "page_type": "methodology",
      "canonical_breadcrumb": "HY-IG v2 -> Methodology",
      "inbound_links": ["app/app.py landing card", "9_hy_ig_v2_spy_strategy.py cross-ref"]
    }
  }
}
